{
  "id": "rally-clash",
  "type": "game",
  "category": "games",
  "subtype": "arcade",
  "status": "published",
  "title": "Arcade: Rally Clash",
  "shortTitle": "Rally Clash",
  "description": "Take on the computer in this Pong-inspired browser arcade game. Stay sharp, return the ball, and be the first to reach 5 points.",
  "excerpt": "Battle the computer and race to 5 points.",
  "url": "/games/rally-clash/",
  "canonicalUrl": "https://fromastoryteller.com/games/rally-clash/",
  "slug": "rally-clash",
  "datePublished": "2026-03-22",
  "dateModified": "2026-10-19",
  "author": "9acaaa0d-24ea-4c2b-a398-ead0d4231a4d",
  "authorDisplay": "Ry",
  "publisher": "From A Storyteller",
  "featured": false,
  "pinned": false,
  "draft": false,
  "image": {
    "src": "/assets/images/covers/rally-clash.jpg",
    "alt": "Arcade Rally Clash artwork",
    "width": 1600,
    "height": 900,
    "originalSrc": "/assets/images/games/rally-clash.jpg"
  },
  "card": {
    "title": "Arcade: Rally Clash",
    "description": "Take on the computer in this Pong-inspired browser arcade game. Stay sharp, return the ball, and be the first to reach 5 points.",
    "image": "/assets/images/covers/rally-clash.jpg",
    "imageAlt": "Arcade Rally Clash artwork",
    "icon": "fa-solid fa-gamepad",
    "tags": [
      "Arcade",
      "Retro"
    ]
  },
  "seo": {
    "pageTitle": "Arcade: Rally Clash | From A Storyteller",
    "metaDescription": "Play Arcade: Rally Clash, a browser-based arcade paddle game by From A Storyteller. Battle the computer, survive long rallies, and race to 5 points.",
    "metaKeywords": [
      "arcade game",
      "retro game",
      "paddle game",
      "rally clash"
    ],
    "robots": "index, follow"
  },
  "openGraph": {
    "title": "Arcade: Rally Clash | From A Storyteller",
    "description": "Take on the computer in this Pong-inspired browser arcade game. Stay sharp, return the ball, and be the first to reach 5 points.",
    "image": "/assets/images/covers/rally-clash.jpg",
    "imageAlt": "Arcade Rally Clash artwork",
    "type": "website"
  },
  "twitter": {
    "card": "summary_large_image",
    "title": "Arcade: Rally Clash | From A Storyteller",
    "description": "Take on the computer in this Pong-inspired browser arcade game. Stay sharp, return the ball, and be the first to reach 5 points.",
    "image": "/assets/images/covers/rally-clash.jpg",
    "imageAlt": "Arcade Rally Clash artwork"
  },
  "taxonomy": {
    "tags": [
      "Arcade",
      "Retro"
    ],
    "genres": [
      "Arcade"
    ],
    "themes": [
      "Competition",
      "Skill"
    ]
  },
  "page": {
    "tagline": "A fast-paced paddle duel where every rally matters.",
    "intro": "Take on the computer in this Pong-inspired browser arcade game. Stay sharp, return the ball, and be the first to reach 5 points."
  },
  "gameFeatures": {
    "multiplayer": "off",
    "saves": false
  },
  "metadataVersion": 1,
  "genres": [
    "arcade"
  ],
  "warningIds": [],
  "warningReviewed": true,
  "contentWarning": "",
  "language": "en",
  "tags": [
    "Arcade",
    "Retro"
  ],
  "metadata": {
    "instructions": "Use the on-screen menu to start, pause or restart. Move your paddle with the arrow keys, mouse or touch. Return the ball against the computer; first to five points wins. Sound is optional."
  }
}
